{
  "contract_version": "minerva-knowledge/1.0-draft",
  "source_instance_id": "dev-synthetic",
  "generation": "3f6c9a1e-5b2d-4c8e-9f10-2a3b4c5d6e7f",
  "enabled": false,
  "last_seq": 1061,
  "next_after": 1061,
  "has_more": false,
  "items": [
    {
      "seq": 1061,
      "document_id": "email:5540",
      "document_type": "email",
      "action": "delete",
      "changed_at": "2026-10-20T09:00:00Z",
      "document_revision": 2,
      "reason": "access_revoked"
    }
  ]
}
